{
  "schema_version": "1.0",
  "object_id": "action.recall.note",
  "family": "object",
  "version_anchor": "v1",
  "kind": "action_class",
  "fields": [
    {
      "field_id": "recall_id",
      "type": "string",
      "required": true
    },
    {
      "field_id": "history_refs",
      "type": "array<string>",
      "required": true
    },
    {
      "field_id": "owner_ref",
      "type": "string",
      "required": true
    },
    {
      "field_id": "recall_trigger",
      "type": "string",
      "required": false
    }
  ]
}
