{
  "schema_version": "1.0",
  "object_id": "evidence.recall.note",
  "family": "object",
  "version_anchor": "v1",
  "kind": "evidence_type",
  "fields": [
    {
      "field_id": "recall_id",
      "type": "string",
      "required": true
    },
    {
      "field_id": "source_refs",
      "type": "array<string>",
      "required": true
    },
    {
      "field_id": "prior_decisions",
      "type": "array<string>",
      "required": false
    },
    {
      "field_id": "kept_invariants",
      "type": "array<string>",
      "required": false
    }
  ]
}
