{
  "schema_version": "1.0",
  "object_id": "action.candidate.trial",
  "family": "object",
  "version_anchor": "v1",
  "kind": "action_class",
  "fields": [
    {
      "field_id": "candidate_id",
      "type": "string",
      "required": true
    },
    {
      "field_id": "trial_window",
      "type": "string",
      "required": true
    },
    {
      "field_id": "success_criteria",
      "type": "array<string>",
      "required": true
    },
    {
      "field_id": "failure_signals",
      "type": "array<string>",
      "required": true
    },
    {
      "field_id": "rollback_path",
      "type": "string",
      "required": true
    }
  ]
}
