{
  "schema_version": "1.0",
  "object_id": "action.decision.package",
  "family": "object",
  "version_anchor": "v1",
  "kind": "action_class",
  "fields": [
    {
      "field_id": "package_id",
      "type": "string",
      "required": true
    },
    {
      "field_id": "recommendation",
      "type": "string",
      "required": true
    },
    {
      "field_id": "tradeoffs",
      "type": "array<string>",
      "required": false
    },
    {
      "field_id": "owner_ref",
      "type": "string",
      "required": false
    }
  ]
}
