{
  "schema_version": "1.0",
  "object_id": "action.activation.decision",
  "family": "object",
  "version_anchor": "v1",
  "kind": "action_class",
  "fields": [
    {
      "field_id": "decision_id",
      "type": "string",
      "required": true
    },
    {
      "field_id": "candidate_ref",
      "type": "string",
      "required": true
    },
    {
      "field_id": "owner_ref",
      "type": "string",
      "required": true
    },
    {
      "field_id": "stop_condition",
      "type": "string",
      "required": false
    }
  ]
}
