{
  "schema_version": "1.0",
  "object_id": "approval.to.decision.package",
  "family": "object",
  "version_anchor": "v1",
  "kind": "approval_type",
  "fields": [
    {
      "field_id": "approval_id",
      "type": "string",
      "required": true
    },
    {
      "field_id": "transition_ref",
      "type": "string",
      "required": true
    },
    {
      "field_id": "approver_role_ref",
      "type": "string",
      "required": true
    }
  ]
}
