{
  "schema_version": "1.0",
  "object_id": "action.discussion",
  "family": "object",
  "version_anchor": "v1",
  "kind": "action_class",
  "fields": [
    {
      "field_id": "discussion_id",
      "type": "string",
      "required": true
    },
    {
      "field_id": "topic",
      "type": "string",
      "required": true
    },
    {
      "field_id": "owner_ref",
      "type": "string",
      "required": true
    },
    {
      "field_id": "next_question",
      "type": "string",
      "required": false
    },
    {
      "field_id": "timestamp",
      "type": "date-time",
      "required": false
    }
  ]
}
