{
  "schema_version": "1.0",
  "object_id": "state.design_control_upgrade",
  "family": "object",
  "version_anchor": "v1",
  "kind": "state_profile",
  "fields": [
    {
      "field_id": "objective",
      "type": "string",
      "required": true
    },
    {
      "field_id": "completion_signal",
      "type": "string",
      "required": true
    }
  ]
}
