{
  "schema_version": "1.0",
  "object_id": "evidence.candidate.trial",
  "family": "object",
  "version_anchor": "v1",
  "kind": "evidence_type",
  "fields": [
    {
      "field_id": "candidate_id",
      "type": "string",
      "required": true
    },
    {
      "field_id": "source_refs",
      "type": "array<string>",
      "required": true
    },
    {
      "field_id": "trial_conditions",
      "type": "array<string>",
      "required": true
    },
    {
      "field_id": "failure_signals",
      "type": "array<string>",
      "required": true
    },
    {
      "field_id": "rollback_path",
      "type": "string",
      "required": true
    }
  ]
}
